<?xml version="1.0" encoding="utf-8"?>
<?xml-stylesheet type="text/xml" href="empstyle.xslt"?>
<emp xmlns:xsi="http://www.w3.org/2001/XMLSchema-instance" xsi:noNamespaceSchemaLocation="emp.xsd">
  <E>
    <e_id>1</e_id>
    <e_name>zaman</e_name>
    <e_ctn>4467</e_ctn>
    <e_address>sd-1 north nazimbad karachi </e_address>
    <e_age>4</e_age>
  </E>
  <E>
    <e_id>1</e_id>
    <e_name>asad</e_name>
    <e_ctn>4467</e_ctn>
    <e_address>sd-1 north nazimbad karachi </e_address>
    <e_age>4</e_age>
  </E>
  <E>
    <e_id>1</e_id>
    <e_name>ammad</e_name>
    <e_ctn>4467</e_ctn>
    <e_address>sd-1 north nazimbad karachi </e_address>
    <e_age>4</e_age>
  </E>
  <E>
    <e_id>1</e_id>
    <e_name>zaid</e_name>
    <e_ctn>4467</e_ctn>
    <e_address>sd-1 north nazimbad karachi </e_address>
    <e_age>4</e_age>
  </E>
  <E>
    <e_id>1</e_id>
    <e_name>zaman</e_name>
    <e_ctn>4467</e_ctn>
    <e_address>sd-1 north nazimbad karachi </e_address>
    <e_age>4</e_age>
  </E>
  <E>
    <e_id>1</e_id>
    <e_name>asad</e_name>
    <e_ctn>4467</e_ctn>
    <e_address>sd-1 north nazimbad karachi </e_address>
    <e_age>8</e_age>
  </E>
  <E>
    <e_id>1</e_id>
    <e_name>zaman</e_name>
    <e_ctn>44467</e_ctn>
    <e_address>sd-1 north nazimbad karachi </e_address>
    <e_age>4</e_age>
  </E>
  <E>
    <e_id>1</e_id>
    <e_name>asad</e_name>
    <e_ctn>467</e_ctn>
    <e_address>sd-1 north nazimbad karachi </e_address>
    <e_age>4</e_age>
  </E>
  <E>
    <e_id>1</e_id>
    <e_name>zaman</e_name>
    <e_ctn>467</e_ctn>
    <e_address>sd-1 north nazimbad karachi </e_address>
    <e_age>14</e_age>
  </E>
  <E>
    <e_id>1</e_id>
    <e_name>asad</e_name>
    <e_ctn>44675</e_ctn>
    <e_address>sd-1 north nazimbad karachi </e_address>
    <e_age>30</e_age>
  </E>
  <E>
    <e_id>1</e_id>
    <e_name>zahid</e_name>
    <e_ctn>44467</e_ctn>
    <e_address>sd-1 north nazimbad karachi </e_address>
    <e_age>4</e_age>
  </E>
  <E>
    <e_id>1</e_id>
    <e_name>ali</e_name>
    <e_ctn>44657</e_ctn>
    <e_address>sd-1 north nazimbad karachi </e_address>
    <e_age>6</e_age>
  </E>
  
</emp>

